{"_D":"urn:oasis:names:specification:ubl:schema:xsd:ReceiptAdvice-2",
 "_A":"urn:oasis:names:specification:ubl:schema:xsd:CommonAggregateComponents-2",
 "_B":"urn:oasis:names:specification:ubl:schema:xsd:CommonBasicComponents-2",
 "ReceiptAdvice":{
 "UBLVersionID":{"_":"2.0"},
 "CustomizationID":{"_":"urn:oasis:names:specification:ubl:xpath:ReceiptAdvice-2.0:sbs-1.0-draft"},
 "ProfileID":{"_":"bpid:urn:oasis:names:draft:bpss:ubl-2-sbs-receipt-advice-notification-draft"},
 "ID":{"_":"658398"},
 "CopyIndicator":{"_":false},
 "UUID":{"_":"89F82FA6-5331-491D-83BC-7B6CA7FD047C"},
 "IssueDate":{"_":"2005-06-21"},
 "Note":[{"_":"sample"}],
 "OrderReference":[{
  "ID":{"_":"AEG012345"},
  "SalesOrderID":{"_":"CON0095678"},
  "UUID":{"_":"6E09886B-DC6E-439F-82D1-7CCAC7F4E3B1"},
  "IssueDate":{"_":"2005-06-20"}
 }],
 "DespatchDocumentReference":[{
  "ID":{"_":"565899"},
  "UUID":{"_":"88C7280E-8F10-419F-9949-8EFFFA2842B8"},
  "IssueDate":{"_":"2005-06-20"}
 }],
 "DeliveryCustomerParty":{
  "CustomerAssignedAccountID":{"_":"XFB01"},
  "SupplierAssignedAccountID":{"_":"GT00978567"},
  "Party":{
   "PartyName":[{
    "Name":{"_":"IYT Corporation"}
   }],
   "PostalAddress":{
    "StreetName":{"_":"Avon Way"},
    "BuildingName":{"_":"Thereabouts"},
    "BuildingNumber":{"_":"56A"},
    "CityName":{"_":"Bridgtow"},
    "PostalZone":{"_":"ZZ99 1ZZ"},
    "CountrySubentity":{"_":"Avon"},
    "AddressLine":[{
     "Line":{"_":"3rd Floor, Room 5"}
    }],
    "Country":{
     "IdentificationCode":{"_":"GB"}
    }
   },
   "PartyTaxScheme":[{
    "RegistrationName":{"_":"Bridgtow District Council"},
    "CompanyID":{"_":"12356478"},
    "ExemptionReason":[{"_":"Local Authority"}],
    "TaxScheme":{
     "ID":{"_":"UK VAT"},
     "TaxTypeCode":{"_":"VAT"}
    }
   }],
   "Contact":{
    "Name":{"_":"Mr Fred Churchill"},
    "Telephone":{"_":"0127 2653214"},
    "Telefax":{"_":"0127 2653215"},
    "ElectronicMail":{"_":"fred@iytcorporation.gov.uk"}
   }
  }
 },
 "DespatchSupplierParty":{
  "CustomerAssignedAccountID":{"_":"CO001"},
  "Party":{
   "PartyName":[{
    "Name":{"_":"Consortial"}
   }],
   "PostalAddress":{
    "StreetName":{"_":"Busy Street"},
    "BuildingName":{"_":"Thereabouts"},
    "BuildingNumber":{"_":"56A"},
    "CityName":{"_":"Farthing"},
    "PostalZone":{"_":"AA99 1BB"},
    "CountrySubentity":{"_":"Heremouthshire"},
    "AddressLine":[{
     "Line":{"_":"The Roundabout"}
    }],
    "Country":{
     "IdentificationCode":{"_":"GB"}
    }
   },
   "PartyTaxScheme":[{
    "RegistrationName":{"_":"Farthing Purchasing Consortium"},
    "CompanyID":{"_":"175 269 2355"},
    "ExemptionReason":[{"_":"N/A"}],
    "TaxScheme":{
     "ID":{"_":"VAT"},
     "TaxTypeCode":{"_":"VAT"}
    }
   }],
   "Contact":{
    "Name":{"_":"Mrs Bouquet"},
    "Telephone":{"_":"0158 1233714"},
    "Telefax":{"_":"0158 1233856"},
    "ElectronicMail":{"_":"bouquet@fpconsortial.co.uk"}
   }
  }
 },
 "Shipment":{
  "ID":{"_":"1"},
  "Consignment":[{
   "ID":{"_":"1"}
  }],
  "Delivery":{
   "ID":{"_":"1"},
   "Quantity":{"_":90,
    "unitCode":"KGM"},
   "ActualDeliveryDate":{"_":"2005-06-20"},
   "ActualDeliveryTime":{"_":"11:30:00.0Z"},
   "RequestedDeliveryPeriod":{
    "StartDate":{"_":"2005-06-20"},
    "StartTime":{"_":"10:30:47.0Z"},
    "EndDate":{"_":"2005-06-21"},
    "EndTime":{"_":"10:30:47.0Z"}
   }
  }
 },
 "ReceiptLine":[{
  "ID":{"_":"1"},
  "Note":[{"_":"SAMPLE"}],
  "ReceivedQuantity":{"_":90,
   "unitCode":"KGM"},
  "ShortQuantity":{"_":10,
   "unitCode":"KGM"},
  "Item":[{
   "Description":[{"_":"Acme beeswax"}],
   "Name":{"_":"beeswax"},
   "BuyersItemIdentification":{
    "ID":{"_":"6578489"}
   },
   "SellersItemIdentification":{
    "ID":{"_":"17589683"}
   },
   "ItemInstance":[{
    "LotIdentification":{
     "LotNumberID":{"_":"546378239"},
     "ExpiryDate":{"_":"2010-01-01"}
    }
   }]
  }]
 }]
}}